,Name,Purpose
0,Mitchell LLC, Configurable background pricing structure for harness distributed convergence
1,Rose Inc,User-friendly impactful framework for exploit interactive web-readiness
2,Garcia-Flores,Quality-focused incremental pricing structure for scale viral e-tailers
3,Hall LLC,Reduced directional policy for re-intermediate best-of-breed solutions
4,Alvarado Ltd,Operative systematic product for integrate distributed metrics
5,Allen Ltd,Open-source 4thgeneration installation for incubate dynamic e-commerce
6,Carter Group,Customizable user-facing circuit for productize sticky eyeballs
7,"Smith, Jones and Lowe",Open-source multimedia knowledge user for drive visionary experiences
8,"Trujillo, Boyd and Barrett",Synergized modular Graphical User Interface for enable virtual initiatives
9,Smith and Sons,Assimilated system-worthy access for productize bricks-and-clicks supply-chains
10,Phillips-Ramirez,Reactive global synergy for engineer customized eyeballs
11,Conley LLC,Organized dynamic matrix for generate real-time users
12,Garcia LLC,Down-sized hybrid adapter for grow open-source niches
13,Flores-Gray,Synchronized demand-driven website for synthesize cutting-edge e-services
14,Lopez-Williams,Up-sized homogeneous migration for re-intermediate synergistic web services
15,Freeman and Sons,Persistent reciprocal product for transition back-end paradigms
16,Bailey Ltd,Object-based systemic flexibility for deploy plug-and-play convergence
17,"Preston, Williams and Sosa",Multi-lateral mission-critical utilization for productize out-of-the-box networks
18,Walton Group,Open-source uniform approach for strategize synergistic models
19,Thompson-Hernandez,Reverse-engineered demand-driven standardization for e-enable cross-platform applications
20,Russo-Mason,Networked cohesive flexibility for target front-end solutions
21,"Bishop, Cox and Robinson",Cross-platform static algorithm for whiteboard cutting-edge bandwidth
22,Estrada PLC,Virtual context-sensitive migration for target revolutionary models
23,"Johnson, Murphy and Sullivan",Open-source asymmetric analyzer for innovate out-of-the-box systems
24,"Lewis, Serrano and Rowland",Compatible bandwidth-monitored monitoring for unleash user-centric deliverables
25,"Powell, Sharp and Smith",Assimilated holistic matrix for drive mission-critical e-services
26,"Guerrero, Gonzales and Browning",Profound local benchmark for repurpose transparent systems
27,Williams-Chen,Customizable didactic matrix for deliver best-of-breed partnerships
28,Robbins Inc,Pre-emptive bi-directional core for productize world-class mindshare
29,"Moreno, Williams and Compton",Fundamental motivating portal for syndicate efficient supply-chains
30,Kidd-Boone,Self-enabling multimedia data-warehouse for morph collaborative web services
31,Brown-Clay,Diverse modular open system for grow world-class networks
32,Williams PLC,Automated stable analyzer for morph virtual technologies
33,"Waters, Bell and Brennan",Organic asymmetric parallelism for deliver user-centric vortals
34,Patterson and Sons,Networked clear-thinking standardization for orchestrate intuitive platforms
35,Thomas LLC,Down-sized heuristic flexibility for engineer web-enabled web services
36,Freeman Group,Compatible modular software for re-contextualize one-to-one e-commerce
37,"Brennan, Lewis and Barry",Distributed non-volatile policy for generate global content
38,Roach and Sons,Streamlined eco-centric system engine for disintermediate strategic e-commerce
39,Alexander LLC,Universal grid-enabled alliance for matrix turn-key solutions
40,Huff Ltd,Future-proofed human-resource approach for enable back-end functionalities
41,Roberts Ltd,Business-focused well-modulated implementation for optimize proactive e-commerce
42,Richmond-Waters,Synchronized national groupware for grow transparent bandwidth
43,Palmer-Branch,Multi-tiered eco-centric algorithm for mesh world-class e-business
44,Howard and Sons,Phased exuding definition for expedite enterprise technologies
45,Mason PLC,Ameliorated zero tolerance service-desk for revolutionize revolutionary platforms
46,Miller-Larson,Synchronized clear-thinking adapter for streamline synergistic eyeballs
47,Davis-Farrell,Persistent analyzing encoding for exploit 24/365 applications
48,Butler LLC,Diverse foreground budgetary management for e-enable scalable platforms
49,Mclaughlin-Young,Adaptive dedicated workforce for exploit enterprise solutions
0, Lang Ltd, Visionary maximized toolset for cultivate innovative metrics
1, Herrera-Williams, Robust full-range task-force for productize dot-com niches
2, Sanchez-Mullins, Networked dedicated hardware for monetize customized portals
3, Gomez-Porter, Phased bandwidth-monitored parallelism for engage efficient schemas
4, Wilson-Christensen, Integrated incremental monitoring for generate cross-platform action-items
5," Brown, Olson and Miller", Reduced mobile solution for disintermediate best-of-breed ROI
6," Curry, Howell and Sanchez", Realigned scalable open architecture for embrace virtual deliverables
7," Williamson, Moore and Tran", Customer-focused 4thgeneration access for productize real-time portals
8, Sutton-Bradford, Cross-platform disintermediate protocol for maximize granular infrastructures
9, York-Horn, Total static architecture for seize value-added content
10, Castillo-Johns, Multi-layered holistic encryption for implement web-enabled action-items
11," Becker, Davis and Parks", Progressive executive toolset for harness web-enabled portals
12, Long-Williams, Visionary 5thgeneration archive for maximize out-of-the-box vortals
13, Castillo-Wilson, Persistent optimizing complexity for incentivize extensible e-business
14, Gonzales-Wilson, Seamless optimal system engine for reinvent B2B experiences
15, Morgan Inc, Multi-tiered clear-thinking portal for aggregate global action-items
16, Alexander PLC, Function-based high-level function for incubate cutting-edge schemas
17, Mcpherson-Ashley, Reduced 3rdgeneration adapter for re-contextualize robust relationships
18, Smith and Sons, Profit-focused non-volatile complexity for scale plug-and-play web-readiness
19, Brewer PLC, Multi-layered 24hour toolset for disintermediate revolutionary info-mediaries
20, Pierce and Sons, Function-based analyzing pricing structure for incubate enterprise metrics
21, Wallace Inc, Persevering regional installation for syndicate visionary applications
22," Graham, Jarvis and Warner", Enhanced mobile benchmark for synergize bleeding-edge experiences
23, Moore PLC, Quality-focused value-added paradigm for synergize sticky markets
24," Ochoa, Copeland and Skinner", Horizontal asymmetric info-mediaries for extend innovative communities
25, Luna-Watson, Diverse tangible functionalities for grow wireless supply-chains
26," Pitts, Burke and Wright", Extended national success for implement leading-edge content
27," Johnson, Blake and Allen", Reduced full-range algorithm for deploy cutting-edge web services
28," Zuniga, Wise and Mann", Function-based static functionalities for productize virtual synergies
29, Flores-Edwards, User-centric coherent instruction set for incentivize best-of-breed e-commerce
30," Fuller, Hanson and Bryant", Managed leadingedge utilization for optimize best-of-breed e-commerce
31," Campbell, Zuniga and Bailey", Re-contextualized composite Internet solution for expedite robust eyeballs
32," Jones, Graham and Evans", Organic bandwidth-monitored monitoring for incentivize dynamic experiences
33, White Inc, Compatible secondary challenge for incubate frictionless mindshare
34," Bates, Brown and Gomez", Enterprise-wide explicit extranet for innovate strategic communities
35, Lopez Inc, Right-sized holistic open architecture for target 24/7 e-tailers
36," Hill, Wolfe and Glover", Cross-platform regional forecast for evolve sticky action-items
37, Stevens Inc, Up-sized maximized customer loyalty for cultivate magnetic convergence
38, Hinton Group, Object-based mission-critical database for deploy visionary experiences
39, Lopez PLC, Up-sized systemic leverage for re-contextualize innovative infrastructures
40, Rojas-Butler, Horizontal regional matrix for incentivize real-time bandwidth
41," Fox, Gordon and Young", Virtual homogeneous challenge for enhance vertical systems
42," Boyd, Clark and Clark", Open-architected object-oriented utilization for deploy virtual systems
43, Carroll-Barker, Multi-layered dynamic orchestration for exploit value-added platforms
44, Ward-Estrada, Re-engineered human-resource policy for visualize best-of-breed web-readiness
45," Gomez, Lopez and Lopez", Multi-layered upward-trending access for implement magnetic synergies
46," Douglas, Walker and Nelson", Versatile asynchronous knowledgebase for drive value-added portals
47," Marshall, Blankenship and Hill", Optimized background circuit for redefine user-centric technologies
48, Lewis and Sons, Open-architected motivating installation for expedite viral ROI
49, Brown-Davis, Up-sized transitional productivity for unleash rich applications
0,"Olson, Johnson and Tyler",De-engineered 5thgeneration moratorium for productize intuitive convergence
1,Silva PLC,Programmable contextually-based knowledge user for unleash clicks-and-mortar bandwidth
2,Martinez PLC,Cloned leadingedge collaboration for evolve bleeding-edge partnerships
3,Kennedy Group,Ameliorated real-time instruction set for redefine revolutionary paradigms
4,Kirby PLC,Programmable clear-thinking open architecture for enhance innovative web services
5,Wood-Morris,Ergonomic multi-state customer loyalty for transform frictionless info-mediaries
6,"Walker, Frank and Munoz",Upgradable dedicated infrastructure for engage bricks-and-clicks solutions
7,Gonzalez-Meyer,Synergized grid-enabled info-mediaries for evolve intuitive bandwidth
8,"Cooper, Collins and Lewis",Cross-platform hybrid strategy for disintermediate back-end eyeballs
9,Jones-Freeman,Innovative solution-oriented toolset for aggregate world-class content
10,Berry Group,Proactive grid-enabled protocol for envisioneer end-to-end functionalities
11,"Dudley, Brown and White",Face-to-face attitude-oriented initiative for optimize granular action-items
12,Kramer-Hodges,Multi-lateral fresh-thinking monitoring for matrix compelling content
13,"Edwards, Ramirez and Mclean",De-engineered transitional challenge for architect virtual applications
14,"Figueroa, Edwards and Parks",Multi-layered bandwidth-monitored database for expedite interactive applications
15,Whitaker Group,De-engineered holistic policy for evolve visionary experiences
16,Reynolds-Stewart,Object-based multimedia portal for utilize real-time content
17,Lewis-Thompson,Configurable modular benchmark for architect vertical partnerships
18,"Martin, Palmer and Alexander",Sharable asynchronous artificial intelligence for enable enterprise channels
19,"Jackson, Rich and Johnson",Optimized contextually-based definition for embrace frictionless web services
20,"Hernandez, Johnson and Carter",Networked context-sensitive challenge for extend end-to-end e-commerce
21,Bishop Ltd,Automated next generation monitoring for seize killer applications
22,Watkins Inc,Inverse 3rdgeneration strategy for synthesize viral deliverables
23,Anderson-Baker,Multi-tiered asymmetric strategy for re-intermediate cross-platform functionalities
24,Ellis Inc,Assimilated real-time capability for productize front-end experiences
25,"King, Alexander and Walters",Decentralized motivating migration for monetize out-of-the-box solutions
26,"Kirby, Atkinson and Page",Pre-emptive fault-tolerant function for unleash revolutionary platforms
27,Hoffman-Garrison,Fully-configurable stable infrastructure for streamline transparent initiatives
28,Thomas and Sons,Quality-focused static emulation for empower value-added paradigms
29,"Bradley, Hickman and Rivera",Assimilated scalable middleware for implement sticky e-tailers
30,"Castaneda, Cox and Carson",Focused methodical project for optimize end-to-end synergies
31,"Stevenson, Perez and Benson",Grass-roots systematic ability for engineer scalable methodologies
32,Holt Inc,Extended static workforce for scale turn-key e-tailers
33,Mitchell-Elliott,Virtual zero-defect focus group for empower viral mindshare
34,"Myers, Leach and Watkins",Organized tangible standardization for reinvent 24/365 niches
35,"Petty, Henry and Thomas",Exclusive dedicated definition for transform plug-and-play supply-chains
36,Butler LLC,Reverse-engineered hybrid workforce for exploit e-business action-items
37,Haynes-Osborn,Enhanced clear-thinking protocol for matrix visionary e-services
38,"Mckee, Walton and Howell",Decentralized attitude-oriented moratorium for architect transparent e-tailers
39,Mendez Inc,Synergistic mission-critical model for embrace out-of-the-box e-tailers
40,Harrison-Stone,Function-based foreground architecture for scale world-class paradigms
41,Hoffman Inc,Profound demand-driven application for engineer web-enabled bandwidth
42,Holloway-Coleman,Future-proofed methodical budgetary management for matrix open-source content
43,"Beck, Chambers and Love",Decentralized motivating core for iterate B2B web-readiness
44,Smith-Morales,Reactive background product for iterate viral web-readiness
45,Martinez LLC,Adaptive zero tolerance throughput for productize e-business synergies
46,Jacobs Group,Horizontal tangible conglomeration for harness transparent solutions
47,Beltran and Sons,Managed executive Local Area Network for streamline distributed technologies
48,Lewis-Hill,Face-to-face 3rdgeneration data-warehouse for target cross-platform e-services
49,"Huang, Ramirez and Soto",Function-based 6thgeneration Graphical User Interface for optimize end-to-end convergence
0, Dixon Ltd, Public-key uniform system engine for grow rich technologies
1," Aguilar, Kelly and Elliott", Managed secondary task-force for facilitate granular applications
2," Martin, Clayton and Smith", Realigned executive task-force for iterate scalable partnerships
3, Moon-Bowen, Cloned zero tolerance instruction set for extend bleeding-edge vortals
4, Grant-Shaw, Operative solution-oriented Graphic Interface for deliver value-added functionalities
5, Gonzalez PLC, Grass-roots multi-state hardware for orchestrate killer metrics
6, Rivera-Montgomery, Monitored demand-driven access for envisioneer ubiquitous metrics
7, Rodriguez-Lopez, Universal multimedia knowledgebase for transition integrated vortals
8," Harris, Callahan and Vaughan", Optional transitional standardization for maximize sticky vortals
9, Parks Inc, Compatible high-level framework for engage sticky bandwidth
10, Mcdonald-Henry, Right-sized 24hour database for engineer B2B web services
11, Boone Group, Exclusive maximized Graphic Interface for synergize cutting-edge markets
12," Anderson, Cisneros and Warner", Total national instruction set for disintermediate value-added communities
13," Castro, Ingram and Diaz", Distributed eco-centric pricing structure for deploy proactive e-business
14," Williams, Thomas and Montgomery", Persevering responsive solution for synergize frictionless synergies
15, Flores-Hernandez, Front-line next generation capability for orchestrate efficient functionalities
16," Cruz, Holmes and Hurley", Reduced leadingedge challenge for re-contextualize front-end e-markets
17, Davis-Summers, Enterprise-wide bandwidth-monitored parallelism for visualize value-added interfaces
18, Palmer Group, Customizable zero tolerance alliance for brand rich channels
19, Francis and Sons, Open-source needs-based software for grow proactive partnerships
20, Jordan-Steele, Fundamental radical open architecture for repurpose scalable e-services
21," Reed, Gregory and Lee", Intuitive secondary ability for revolutionize bleeding-edge content
22, Martinez LLC, Seamless local framework for scale plug-and-play action-items
23, Ellis-Harrell, Business-focused client-driven complexity for incubate one-to-one networks
24, Pena and Sons, Customizable 6thgeneration strategy for matrix intuitive content
25, Robinson Inc, Multi-channeled dedicated groupware for utilize bleeding-edge content
26, Choi LLC, Future-proofed upward-trending Graphical User Interface for integrate cross-platform e-commerce
27, Mathis LLC, Polarized zero administration orchestration for integrate visionary eyeballs
28," Carroll, King and Jackson", Visionary dynamic artificial intelligence for deliver leading-edge relationships
29, Williams Ltd, Stand-alone reciprocal parallelism for innovate compelling synergies
30, Patterson LLC, Phased bi-directional approach for benchmark e-business infrastructures
31, Leonard LLC, Object-based systematic customer loyalty for utilize 24/7 eyeballs
32," Diaz, Smith and Salazar", Grass-roots multi-state Internet solution for orchestrate best-of-breed platforms
33," Shelton, Collins and Harris", Face-to-face multi-state leverage for embrace bricks-and-clicks deliverables
34, Richardson Inc, Monitored zero tolerance framework for architect turn-key users
35, Brown-Garcia, Virtual interactive software for engage viral metrics
36, Fisher-Campbell, Managed didactic success for transform user-centric ROI
37," Myers, Torres and Meyer", Monitored executive installation for target synergistic synergies
38, Miller PLC, Realigned bi-directional open system for grow world-class e-services
39, Hall-Smith, Switchable 5thgeneration definition for revolutionize impactful functionalities
40," Cameron, Tanner and Smith", Advanced eco-centric initiative for seize one-to-one metrics
41, Salazar Group, Adaptive tertiary access for synthesize bleeding-edge technologies
42," Rodriguez, Sutton and Martinez", Profit-focused actuating utilization for leverage virtual communities
43, Garcia Group, Grass-roots zero tolerance adapter for revolutionize cutting-edge synergies
44, Maxwell Group, Fully-configurable static solution for benchmark web-enabled architectures
45, Mckinney-Rodriguez, Self-enabling radical collaboration for exploit sticky content
46, Reyes-Cooper, Extended next generation hierarchy for incentivize 24/365 schemas
47, Weaver-Sullivan, Front-line modular adapter for transition wireless users
48, Pope Inc, Synergized empowering data-warehouse for re-intermediate front-end e-business
49, White PLC, Integrated fresh-thinking frame for streamline impactful paradigms
